raw_text,cleaned_text,domain,sentiment,intensity,intensity_level
绝对正版图书，只要将三大本中的内容看明白、吃透，在辅佐些真题，相信司考定会取得极佳的成绩~貌似司考并不是智商的考试，而是情商的考核~很长时间的准备，关键在于坚持！希望同在司考路上的战友们，都将会取得09年的胜利。最好的学习反复是重复，司考一样受用。踏踏实实的看书，要想成为人上人，就先要过一阵不是人的生活~学习的日子是艰苦的，要耐的住寂寞，摒弃一切诱惑，踏实的看这本书吧！,绝对正版图书 只要将三大本中的内容看明白 吃透 在辅佐些真题 相信司考定会取得极佳的成绩 貌似司考并不是智商的考试 而是情商的考核 很长时间的准备 关键在于坚持 希望同在司考路上的战友们 都将会取得09年的胜利 最好的学习反复是重复 司考一样受用 踏踏实实的看书 要想成为人上人 就先要过一阵不是人的生活 学习的日子是艰苦的 要耐的住寂寞 摒弃一切诱惑 踏实的看这本书吧,ChnSentiCorp,1,5.0,5
直系亲属之间 不能输血 致死几率相当大 要感动更要科学//@最销魂的电影: 太感人了！[泪],直系亲属之间 不能输血 致死几率相当大 要感动更要科学 太感人了 泪,WEIBO,0,3.2,3
送餐晚了一小时、6寸的披萨不如9寸的料实在、味道还行吧,送餐晚了一小时 6寸的披萨不如9寸的料实在 味道还行吧,WAIMAI,0,3.0,3
"送餐太太太太太慢了！！！！！！整整晚了半个多小时！！！,当然，饭菜很好吃",送餐太太太太太慢了 整整晚了半个多小时 当然 饭菜很好吃,WAIMAI,0,0.5,0
"门童好像不错,其他不记得了 晚上睡得还可以",门童好像不错 其他不记得了 晚上睡得还可以,ChnSentiCorp,1,2.2,5
我是3月6日入住的，当时查看了网友对其他酒店的评语，都不怎么样，选择这家是因为当时还没有任何评语。但结果是一样很差，根本不够四星，房间的衣柜里还有蟑螂，我当场拍死了一只。298元/晚绝对不值，和成都相比，价格相等，服务和设备相差太远，下次不会住那里了，如果可能，最好回成都住，绵阳-成都车程只有1小时45分钟。,我是3月6日入住的 当时查看了网友对其他酒店的评语 都不怎么样 选择这家是因为当时还没有任何评语 但结果是一样很差 根本不够四星 房间的衣柜里还有蟑螂 我当场拍死了一只 298元 晚绝对不值 和成都相比 价格相等 服务和设备相差太远 下次不会住那里了 如果可能 最好回成都住 绵阳 成都车程只有1小时45分钟,ChnSentiCorp,0,0.3,0
一年真快[泪][泪][泪][泪],一年真快 泪 泪 泪 泪,WEIBO,0,3.6,4
从症状来看，这些花茶我都需要[泪],从症状来看 这些花茶我都需要 泪,WEIBO,0,2.3,2
这个妹子太有爱了[抓狂][偷笑][哈哈],这个妹子太有爱了 抓狂 偷笑 哈哈,WEIBO,0,5.0,5
好吃又便宜,好吃又便宜,WAIMAI,1,1.0,1
[哈哈]房比车贵了还能靠房车撑着 //@牙医Rex:这个和别人讨论过，买个697那种大公共 ，改装一下，谁怕房价高啊～切,哈哈 房比车贵了还能靠房车撑着 改装一下 谁怕房价高啊 切,WEIBO,1,1.8,2
觉得是住过酒店最差的一家，一楼房间接近地下层，空气不好，而且酒店还在涮漆整修中，油漆气味很难闻....早上七点钟不到，施工人员和服务人员就在走廊上吵到不行....而且，酒店位置很难找，在胡同里！...总之印象超差,觉得是住过酒店最差的一家 一楼房间接近地下层 空气不好 而且酒店还在涮漆整修中 油漆气味很难闻 早上七点钟不到 施工人员和服务人员就在走廊上吵到不行 而且 酒店位置很难找 在胡同里 总之印象超差,ChnSentiCorp,0,5.0,5
"不知道为什么晚了三十分钟,后定的东西都到了和合谷还没到,已经饿到胃疼了,菜还可以,到的时候也有点凉了,以后不会再定了",不知道为什么晚了三十分钟 后定的东西都到了和合谷还没到 已经饿到胃疼了 菜还可以 到的时候也有点凉了 以后不会再定了,WAIMAI,0,5.0,5
下雨了，感谢送餐员,下雨了 感谢送餐员,WAIMAI,1,1.2,1
"送餐时间太久,都凉了",送餐时间太久 都凉了,WAIMAI,0,3.5,3
@Shengwei_Geekette 你没去围观一下吗[哈哈],你没去围观一下吗 哈哈,WEIBO,1,3.9,4
想吃[爱你][花心],想吃 爱你 花心,WEIBO,1,1.3,1
再送小哥超帅！！！！,再送小哥超帅,WAIMAI,1,2.1,2
这麻酱做的是巨恶心,这麻酱做的是巨恶心,WAIMAI,0,3.6,4
//@王紫微myy: @玩家旅游杂志 @pppMarch @Coco--Hu @madeingenii @酒店爱好者 @Mika_崔 //@全球订房网: 能不能不要这么可爱啊[抓狂] [抓狂],能不能不要这么可爱啊 抓狂 抓狂,WEIBO,0,0.2,0
刚开机没一会 就很热了机子 作为10寸便携小本 还是厚了点 还是重了点 因为电池的缘故吧 因为蓄电时间的提升 忍了~,刚开机没一会 就很热了机子 作为10寸便携小本 还是厚了点 还是重了点 因为电池的缘故吧 因为蓄电时间的提升 忍了,ChnSentiCorp,0,2.2,2
价格便宜，功能强大。去中关村拿还要3600带票呢，这次才3299带票。够便宜,价格便宜 功能强大 去中关村拿还要3600带票呢 这次才3299带票 够便宜,ChnSentiCorp,1,2.9,3
"送的超级慢…,薯条都干了,整个俩小时才送到",送的超级慢 薯条都干了 整个俩小时才送到,WAIMAI,0,2.7,3
广州小地震了一下下，大家有feel到么？[衰],广州小地震了一下下 大家有feel到么 衰,WEIBO,0,1.5,1
[鼓掌][太开心] //@-看海听涛-:老准呢！,鼓掌 太开心,WEIBO,1,4.1,4
我这个没福气的人那，在家休息连续几天都是6点醒，要不要，行不行呀，还上不上人活了[泪][泪][泪][泪][泪][泪][睡觉][睡觉][睡觉] 我在:http://t.cn/zT4yawR,我这个没福气的人那 在家休息连续几天都是6点醒 要不要 行不行呀 还上不上人活了 泪 泪 泪 泪 泪 泪 睡觉 睡觉 睡觉 我在,WEIBO,0,5.0,5
昨天我把这套书看完了，结尾我不是很喜欢有点太戏剧了，但对书中的主人公却是最好的安排，我去过新疆，但是因为时间太短加之新疆的地域有点过于广阔所以好多的地方都没去成，看完这本书之后我又有了去新疆的念头，也因为深深的喜欢上了这个帅哥和尚，也找了几本佛经看看，就是有点看不懂，慢慢来吧，小春继续你的写作，我支持你,昨天我把这套书看完了 结尾我不是很喜欢有点太戏剧了 但对书中的主人公却是最好的安排 我去过新疆 但是因为时间太短加之新疆的地域有点过于广阔所以好多的地方都没去成 看完这本书之后我又有了去新疆的念头 也因为深深的喜欢上了这个帅哥和尚 也找了几本佛经看看 就是有点看不懂 慢慢来吧 小春继续你的写作 我支持你,ChnSentiCorp,1,5.0,5
"#初走澳洲#布里斯班有着迷人的自然风光，很多小动物与人类十分亲近。在布里斯班西南约11公里处 ""龙柏考拉保护区Lone Pine Koala Sanctuary"" 是世界上最大的考拉保护区，坐落在风景宜人的河边公园内，今天抱了考拉，还有和袋鼠亲密接触,很开心的玩了一个下午。[太开心] #带着微博去旅行#",布里斯班有着迷人的自然风光 很多小动物与人类十分亲近 在布里斯班西南约11公里处 龙柏考拉保护区Lone Pine Koala Sanctuary 是世界上最大的考拉保护区 坐落在风景宜人的河边公园内 今天抱了考拉 还有和袋鼠亲密接触 很开心的玩了一个下午 太开心,WEIBO,1,5.0,5
反正每人最多限20次，转评。。。。//@H爱情拼图F: 上次的小王我猜的不是第一个，这次猜大王[抓狂],反正每人最多限20次 转评 上次的小王我猜的不是第一个 这次猜大王 抓狂,WEIBO,0,0.1,0
满意，速度也非常快。,满意 速度也非常快,WAIMAI,1,5.0,5
有点小辣，还不错，不过男生吃可能会太少,有点小辣 还不错 不过男生吃可能会太少,WAIMAI,1,2.7,3
挺好吃的，好吃不能怕贵，值得,挺好吃的 好吃不能怕贵 值得,WAIMAI,1,2.9,3
"量太大了,还算准时,喜欢黄太吉",量太大了 还算准时 喜欢黄太吉,WAIMAI,1,1.6,2
大份的超级大，里面好多大肉块,大份的超级大 里面好多大肉块,WAIMAI,1,0.8,1
真难吃，哪有五花肉啊?光是白菜和萝卜丝，这东西还好意思拿出来卖,真难吃 哪有五花肉啊 光是白菜和萝卜丝 这东西还好意思拿出来卖,WAIMAI,0,3.3,3
位置没有携程说的那么中心，距离天河购物中心开车约6-7分钟，走路的话就免了吧。 酒店设施和装修很一般，最多一个三星标准。 不会再选择这个地方住。,位置没有携程说的那么中心 距离天河购物中心开车约6 7分钟 走路的话就免了吧 酒店设施和装修很一般 最多一个三星标准 不会再选择这个地方住,ChnSentiCorp,0,1.1,1
色即是空，空即是色。。。。念给你听的！哈哈。。。 //@火车睡着了:[嘻嘻] 你看见什么了这是？口水都当啷下来了,色即是空 空即是色 念给你听的 哈哈 你看见什么了这是 口水都当啷下来了,WEIBO,1,1.7,2
曾经经历过车祸的人，心里多少都会有些阴影的，这一点偶深有体会......小厉一定是属于阴影还未散去那类人，所以对写意不系安全带的反映这么激烈！可怜了写意，还不明所以，以为这个皮笑肉不笑的家伙喜怒无常，阴情不定，真是惨！,曾经经历过车祸的人 心里多少都会有些阴影的 这一点偶深有体会 小厉一定是属于阴影还未散去那类人 所以对写意不系安全带的反映这么激烈 可怜了写意 还不明所以 以为这个皮笑肉不笑的家伙喜怒无常 阴情不定 真是惨,ChnSentiCorp,1,5.0,5
散热一般，鼠标有点小。 最大的问题是第一次开机就听到底部有一个风扇的声音不正常，特别响！ 打电话到京东客服，给我推到华硕的客服去了。。。 用手按了按，发现就是风扇的声音，还不知道怎么解决呢！,散热一般 鼠标有点小 最大的问题是第一次开机就听到底部有一个风扇的声音不正常 特别响 打电话到京东客服 给我推到华硕的客服去了 用手按了按 发现就是风扇的声音 还不知道怎么解决呢,ChnSentiCorp,0,3.2,3
阳光不是一般的充足吖[微风][微风][微风][咖啡]晒黑了算了[委屈][太开心][思考],阳光不是一般的充足吖 微风 微风 微风 咖啡 晒黑了算了 委屈 太开心 思考,WEIBO,1,1.6,2
[衰]@Sabrina海螃蟹 @Mr于川 //@向啥啥红: 忒神了～～,衰 忒神了,WEIBO,0,3.2,3
9元价格很实惠，米饭量少，吃不饱。,9元价格很实惠 米饭量少 吃不饱,WAIMAI,0,5.0,5
在临安还算是个不错的酒店，但是现在越来越差了。房间地毯非常脏；窗户隔音非常差，外面就是马路，只要有车就很吵；卫生间挂毛巾的地方都没有，除非台板下面；没有免费的饮用水；总台的服务很差，好像是你欠她的。不过也有好的方面：最近一次入住长话免费打，虽然我几乎不打；早餐不贵，而且很多健康食品。,在临安还算是个不错的酒店 但是现在越来越差了 房间地毯非常脏 窗户隔音非常差 外面就是马路 只要有车就很吵 卫生间挂毛巾的地方都没有 除非台板下面 没有免费的饮用水 总台的服务很差 好像是你欠她的 不过也有好的方面 最近一次入住长话免费打 虽然我几乎不打 早餐不贵 而且很多健康食品,ChnSentiCorp,0,0.1,0
[衰]其实台湾用大陆陌生交友软件用户比例相当高！@奇遇小精灵,衰 其实台湾用大陆陌生交友软件用户比例相当高,WEIBO,0,3.9,4
味道很不错，送来还是热的,味道很不错 送来还是热的,WAIMAI,1,3.3,3
送餐特别慢。等了快一个半小时。说好了有事有急事。还是等了好长时间,送餐特别慢 等了快一个半小时 说好了有事有急事 还是等了好长时间,WAIMAI,0,3.0,3
一、最显著的优点是电池使用时间长；二、配置比较齐全：无线、蓝牙、摄像必备的都有；三、做工还不错，烤漆的也比较漂亮；四、小巧便携，就一本杂志大小，一般书包就能装下；五、品牌还可以，网上的资料相对较全；六、一般情况下硬盘和风扇声音还不算太大。,一 最显著的优点是电池使用时间长 二 配置比较齐全 无线 蓝牙 摄像必备的都有 三 做工还不错 烤漆的也比较漂亮 四 小巧便携 就一本杂志大小 一般书包就能装下 五 品牌还可以 网上的资料相对较全 六 一般情况下硬盘和风扇声音还不算太大,ChnSentiCorp,1,5.0,5
不错，就是地三鲜油太大了,不错 就是地三鲜油太大了,WAIMAI,1,3.4,2
触屏上面有一个小突起，弄不掉，硬盘分区是225G+1G+10G，简直是搞笑,触屏上面有一个小突起 弄不掉 硬盘分区是225G 1G 10G 简直是搞笑,ChnSentiCorp,0,0.2,0
天啊，不要对小朋友这么狠[衰]  //@中秋月亮人:小象没长眼，大象没心肝~,天啊 不要对小朋友这么狠 衰,WEIBO,0,4.1,4
配送大哥很热情，东西很好吃,配送大哥很热情 东西很好吃,WAIMAI,1,5.0,5
货到手很慢 9号下的单付完款 16号下午才拿到货 EMS才三天 只能说货发的慢了 还有就是降价真的太快了吧 哎，小郁闷,货到手很慢 9号下的单付完款 16号下午才拿到货 EMS才三天 只能说货发的慢了 还有就是降价真的太快了吧 哎 小郁闷,ChnSentiCorp,0,2.9,3
"多收了2块钱,不知道为什么？",多收了2块钱 不知道为什么,WAIMAI,1,2.0,2
外观漂亮，在实体店见过，收到货的时候没失望。谁看都说不错。散热还行吧，因为用着散热器，也没去观察。,外观漂亮 在实体店见过 收到货的时候没失望 谁看都说不错 散热还行吧 因为用着散热器 也没去观察,ChnSentiCorp,1,3.5,3
煎饼口味偏淡，有点干，可以改进一下,煎饼口味偏淡 有点干 可以改进一下,WAIMAI,1,2.2,1
很速度，赞，奶茶也好喝。,很速度 赞 奶茶也好喝,WAIMAI,1,3.9,4
下楼梯做扶手滑下来摔了，把后脑勺磕出血！[泪]这些坏事小时全干过！忏悔！[泪] //@台词丶音乐丶电影:几乎全中[偷笑],下楼梯做扶手滑下来摔了 把后脑勺磕出血 泪 这些坏事小时全干过 忏悔 泪,WEIBO,0,5.0,5
很好吃，忘记拍照了～,很好吃 忘记拍照了,WAIMAI,1,2.2,2
包装很好，味道也不错，如果再有点菜叶就更好了，都是肉吃到最后有点腻,包装很好 味道也不错 如果再有点菜叶就更好了 都是肉吃到最后有点腻,WAIMAI,1,5.0,5
[耶]mubarek bolsun //@Zubayde--Tursun: mubarek bolsun @Mominjan_Ablikim aka...[鼓掌][鼓掌][鼓掌],耶 mubarek bolsun mubarek bolsun aka 鼓掌 鼓掌 鼓掌,WEIBO,1,5.0,5
尼玛是生的，为了快也不能这样啊！！,尼玛是生的 为了快也不能这样啊,WAIMAI,0,2.6,3
[心][心][心] //@大连兜兜:我爱大连我爱你！我们会继续每周六走起的[嘻嘻][嘻嘻][嘻嘻],心 心 心,WEIBO,1,0.3,0
//@女人天生爱美丽: 你是否这样爱过一个人[泪]@几米漫画世界,你是否这样爱过一个人 泪,WEIBO,0,2.8,3
速度快態度好,速度快態度好,WAIMAI,1,2.6,3
肥牛一股羊肉味，真是肥，吃恶心了…面基本没味儿！,肥牛一股羊肉味 真是肥 吃恶心了 面基本没味儿,WAIMAI,0,2.6,3
这书籍图片繁琐 翻译的质量也普通 我家小孩子也不怎么喜欢看人家英文的用字用语都是牙牙学语阶段的 翻译的很成人化,这书籍图片繁琐 翻译的质量也普通 我家小孩子也不怎么喜欢看人家英文的用字用语都是牙牙学语阶段的 翻译的很成人化,ChnSentiCorp,0,3.7,4
来呀 //@荆紫: 这不是上次，我们吃饭的地方嘛？我也有吃相的照片，要不要上？[嘻嘻] //@野山狐儿:馋馋山东父老乡亲[哈哈],来呀 这不是上次 我们吃饭的地方嘛 我也有吃相的照片 要不要上 嘻嘻,WEIBO,1,1.8,4
[鼓掌]最后亮了。。。//@高跟鞋恋语: 菲律宾，一张图,鼓掌 最后亮了 菲律宾 一张图,WEIBO,1,2.3,2
"房间是新装修的,用的是浅色调,感觉很温馨,布局较合理,显的比较宽敞.酒店选用的布草很讲究,放在手里感觉到厚实,柔软.服务周到,特别是本人出差带的衣服较多,服务员可以考虑客人的实际需要,随时增加衣架.酒店的饭菜做的有特色,去过不同的楼层,都是满意而归.虽然酒店在细节上有过人之处,但如果在某些地方再改进一下,完全可以和当地的四,五星酒店媲美,如卫生间放置小挂钩可以挂",房间是新装修的 用的是浅色调 感觉很温馨 布局较合理 显的比较宽敞 酒店选用的布草很讲究 放在手里感觉到厚实 柔软 服务周到 特别是本人出差带的衣服较多 服务员可以考虑客人的实际需要 随时增加衣架 酒店的饭菜做的有特色 去过不同的楼层 都是满意而归 虽然酒店在细节上有过人之处 但如果在某些地方再改进一下 完全可以和当地的四 五星酒店媲美 如卫生间放置小挂钩可以挂,ChnSentiCorp,1,5.0,5
看起来真心胖！[抓狂][抓狂][抓狂] //@Baker_Street_焙客街:撒花撒花！[哈哈][哈哈][哈哈],看起来真心胖 抓狂 抓狂 抓狂,WEIBO,1,1.9,2
本机预装的Vista跟瑞星杀软不兼容，蓝屏，不能进入系统，不能自行卸载！！千万小心别装，用卡巴可以。,本机预装的Vista跟瑞星杀软不兼容 蓝屏 不能进入系统 不能自行卸载 千万小心别装 用卡巴可以,ChnSentiCorp,0,2.7,3
回复@一串儿金子:露营公园门票两张你中奖喽 恭喜[嘻嘻] //@一串儿金子:给我抢两张,回复 恭喜 嘻嘻,WEIBO,1,2.7,2
美丽的红月亮，我和八喜一起！[亲亲],美丽的红月亮 我和八喜一起 亲亲,WEIBO,1,5.0,3
一个同事向我推荐这本书，于是我满怀希望地跟当当订货，结果苦等了两周之后，寄来的东西根本不是这本书，他们又一次把货发错了，我退货之后至今仍未收到那本书，相当的郁闷啊！,一个同事向我推荐这本书 于是我满怀希望地跟当当订货 结果苦等了两周之后 寄来的东西根本不是这本书 他们又一次把货发错了 我退货之后至今仍未收到那本书 相当的郁闷啊,ChnSentiCorp,0,5.0,5
卷饼不错好吃，粥一般,卷饼不错好吃 粥一般,WAIMAI,1,4.2,4
好吃，肉很多，连续两天都吃这个,好吃 肉很多 连续两天都吃这个,WAIMAI,1,1.2,1
薯条皮了，奶酪棒没味道,薯条皮了 奶酪棒没味道,WAIMAI,1,2.4,2
"煎饼好吃,外卖速度快",煎饼好吃 外卖速度快,WAIMAI,1,4.1,4
一如既往，今天的状况理解,一如既往 今天的状况理解,WAIMAI,1,0.6,1
"还可以,有点干。",还可以 有点干,WAIMAI,1,0.8,1
#书写温暖# 真想和你不期而遇。[嘻嘻] 详情:http://t.cn/zjClOJM,真想和你不期而遇 嘻嘻 详情,WEIBO,1,4.4,4
之前晚归晚，至少还能接受，这可好，11点20订，两个多小时才到，送来了都该上班了，都没有时间吃了，下次不敢订了,之前晚归晚 至少还能接受 这可好 11点20订 两个多小时才到 送来了都该上班了 都没有时间吃了 下次不敢订了,WAIMAI,0,2.5,2
出门，过马路，上人行横道，怎么就摔出去了？整个人扑倒在地，包包飞出老远…[衰][泪],出门 过马路 上人行横道 怎么就摔出去了 整个人扑倒在地 包包飞出老远 衰 泪,WEIBO,0,5.0,5
买书如山倒，读书如抽丝[失望],买书如山倒 读书如抽丝 失望,WEIBO,0,0.8,1
说是12:10分到，结果1点才送来！两个小时才吃上啊！,说是12 10分到 结果1点才送来 两个小时才吃上啊,WAIMAI,0,2.1,2
这本书不象宣传里说得那么好，买到家以后，翻了翻就没有兴趣了。本来是想买回来，让小孩学习英语的，拿到书以后，竟然是中文夹着英语单词，这种脱离文章来学习英文单词的方法，我是不认同的。,这本书不象宣传里说得那么好 买到家以后 翻了翻就没有兴趣了 本来是想买回来 让小孩学习英语的 拿到书以后 竟然是中文夹着英语单词 这种脱离文章来学习英文单词的方法 我是不认同的,ChnSentiCorp,0,1.1,4
"石锅拌饭必须用石锅吃,其它的饭也必须趁热,外卖送过来很难吃",石锅拌饭必须用石锅吃 其它的饭也必须趁热 外卖送过来很难吃,WAIMAI,0,2.6,3
[哈哈] 见怪不怪[哈哈][嘻嘻],哈哈 见怪不怪 哈哈 嘻嘻,WEIBO,1,5.0,5
[泪]我同事这条微博也@了我???//@多向度C: @张丽华larissa @m265,泪 我同事这条微博也,WEIBO,0,1.9,2
当一本教科书看吧，也只适合职场菜鸟，看不出任何价值，亏得这么多人给好评。当小说看吧，文笔实在不怎么样，而且超讨厌书里的女主人公，看着挺完美，实际上骨子里透着股自以为是的上海小女人形象。,当一本教科书看吧 也只适合职场菜鸟 看不出任何价值 亏得这么多人给好评 当小说看吧 文笔实在不怎么样 而且超讨厌书里的女主人公 看着挺完美 实际上骨子里透着股自以为是的上海小女人形象,ChnSentiCorp,0,5.0,5
小屋经历了“水漫金山”之后，窗外的雨又淅淅沥沥的下起来~雨天总是很容易让人陷入沉思~昨晚没开电脑，今早一看邮件N封待处理[抓狂] 疯狂的一周开始了,小屋经历了 水漫金山 之后 窗外的雨又淅淅沥沥的下起来 雨天总是很容易让人陷入沉思 昨晚没开电脑 今早一看邮件N封待处理 抓狂 疯狂的一周开始了,WEIBO,0,1.1,1
机器性能不错。性价比比较高。还送1G内存， 这样就成了2G内存了。跑Vista也行，不过vista占用系统资源比较打，只是做的比较炫而已，建议安装win xp或者 win 7 beta版。,机器性能不错 性价比比较高 还送1G内存 这样就成了2G内存了 跑Vista也行 不过vista占用系统资源比较打 只是做的比较炫而已 建议安装win xp或者 win 7 beta版,ChnSentiCorp,1,3.7,4
"就一汉堡俩小时送到,点餐页面标注30分钟,逗呢？要不是看送餐的是个小姑娘挺不容易,我真是…",就一汉堡俩小时送到 点餐页面标注30分钟 逗呢 要不是看送餐的是个小姑娘挺不容易 我真是,WAIMAI,0,0.9,1
我订的是套餐，怎么只给我送单点的？,我订的是套餐 怎么只给我送单点的,WAIMAI,1,1.2,1
不太好吃…,不太好吃,WAIMAI,1,0.1,0
送餐用了一个小时，一个小时，什么鬼，乌龟都到了，菜还油的要死，我点的炒饭，一堆酱油，只能看到黑乎乎的一坨，是一坨!!!!,送餐用了一个小时 一个小时 什么鬼 乌龟都到了 菜还油的要死 我点的炒饭 一堆酱油 只能看到黑乎乎的一坨 是一坨,WAIMAI,0,5.0,5
本来买来送人的。让我小孩发现了，喜欢得不得了，硬是刨了几个晚上把它看完，还舍不得送人。首先，书的质量很不错。第二，看得出编者很用心整理，真的是小朋友读本，文字简洁易懂。第三，每个故事后都附注说明故事所属的民族，还有讲述人、搜集人等，丰富了故事的背景知识。第四，插图精美，很有特色，让小朋友发挥了无限想象。附带说明，适合二年级以上小朋友阅读，因为没有拼音的。,本来买来送人的 让我小孩发现了 喜欢得不得了 硬是刨了几个晚上把它看完 还舍不得送人 首先 书的质量很不错 第二 看得出编者很用心整理 真的是小朋友读本 文字简洁易懂 第三 每个故事后都附注说明故事所属的民族 还有讲述人 搜集人等 丰富了故事的背景知识 第四 插图精美 很有特色 让小朋友发挥了无限想象 附带说明 适合二年级以上小朋友阅读 因为没有拼音的,ChnSentiCorp,1,5.0,5
战友们要支持豪哥的系列书，希望豪哥继续将自己的心得体会表达出来，让战友们的技术得到提高！,战友们要支持豪哥的系列书 希望豪哥继续将自己的心得体会表达出来 让战友们的技术得到提高,ChnSentiCorp,1,5.0,5
哈哈，太逗了，搬石头砸自己脚的家伙傻眼了~[哈哈] //@李小妮:哈哈哈，有人截屏,哈哈 太逗了 搬石头砸自己脚的家伙傻眼了 哈哈,WEIBO,1,3.1,3
这本是依晨的求学日记，安排得非常紧凑的纽约客生活却充实至极通读完，会觉得这个女孩子比电视中、比想象中更真实，更贴近我们的生活。依晨对新知识的渴望和对新生活的期待，让我也觉得读书真的是一件非常快乐、非常带劲的事情呢！果然，要经常看一些可以鞭策自己的书籍啊~虽然很多人说明星的书很多都是代笔的，但是，我觉得那么真实的感受，怎么可能是代笔的呢！支持依晨——因为你的文字！,这本是依晨的求学日记 安排得非常紧凑的纽约客生活却充实至极通读完 会觉得这个女孩子比电视中 比想象中更真实 更贴近我们的生活 依晨对新知识的渴望和对新生活的期待 让我也觉得读书真的是一件非常快乐 非常带劲的事情呢 果然 要经常看一些可以鞭策自己的书籍啊 虽然很多人说明星的书很多都是代笔的 但是 我觉得那么真实的感受 怎么可能是代笔的呢 支持依晨 因为你的文字,ChnSentiCorp,1,5.0,5
