raw_text,cleaned_text,domain,sentiment,intensity,intensity_level
这个小炒肉不好吃，我吃过的他家最难吃的菜之一,这个小炒肉不好吃 我吃过的他家最难吃的菜之一,WAIMAI,1,0.4,0
今天土豆丝一般，没有之前的好吃，估计换厨师了,今天土豆丝一般 没有之前的好吃 估计换厨师了,WAIMAI,1,1.6,2
"一定不要点炒面,2小时终于坨成了石头",一定不要点炒面 2小时终于坨成了石头,WAIMAI,0,0.8,1
哈哈哈 海哥理解[嘻嘻],哈哈哈 海哥理解 嘻嘻,WEIBO,1,4.0,4
"[泪]//@傅盛: 去过一次非洲肯尼亚,路很烂车很破,所谓highway最高限速也才80公里。不过在路上经常可以看到坚固的校车。黑人司机告诉我,校车是他们路上跑的最好的车。",泪 去过一次非洲肯尼亚 路很烂车很破 所谓highway最高限速也才80公里 不过在路上经常可以看到坚固的校车 黑人司机告诉我 校车是他们路上跑的最好的车,WEIBO,0,4.7,1
我还没吃晚饭，侬晓得伐[怒],我还没吃晚饭 侬晓得伐 怒,WEIBO,0,3.3,3
@米其林菜包儿 看上去不错呦 //@恐怖大王李西闽:真的好吃又安全，晚订就没了[哈哈],看上去不错呦,WEIBO,1,4.5,4
味道其实是大众水平，但是干净，送餐快，真的好服务,味道其实是大众水平 但是干净 送餐快 真的好服务,WAIMAI,1,5.0,5
小日本太残忍了！[怒] //@申云:历史不堪回首！,小日本太残忍了 怒,WEIBO,0,0.8,1
三个小时的等待，服了,三个小时的等待 服了,WAIMAI,0,0.4,0
好的还可以,好的还可以,WAIMAI,1,1.9,2
"//@无妻便是惨:张洁雯的表现力令我惊讶,拍之前是我完全估计吾到的 //@彭巧茵:[鼓掌] “有你地系我身边陪着我，我会觉得更加幸福。”",有你地系我身边陪着我 我会觉得更加幸福,WEIBO,1,3.1,3
微博号@Alekto给大家送祝福啦，TA留：“工作忙碌，大家注意劳逸结合，天天开心”。我们繁忙的一周即将结束，接下来的周末希望亲们都好好休息，祝大家有个愉快的周末。顺便提醒大家，我们的传递祝福活动，赢别墅入住体验券是需要转发关注我们的微博，并且@3位以上好友才有机会噢。。期待。。。[太开心],微博号,WEIBO,1,0.0,0
帮忙测试啊//@??琪:[嘻嘻],帮忙测试啊,WEIBO,1,1.4,1
续航时间短 有6芯电池就好了 散热差了点 3-5个小时就有点烫手 硬盘没分区只有1个C盘 OFFCIE是正版的就好了,续航时间短 有6芯电池就好了 散热差了点 3 5个小时就有点烫手 硬盘没分区只有1个C盘 OFFCIE是正版的就好了,ChnSentiCorp,0,0.1,0
对于写评论，说实在比较懒，但对于这本书真的是值得我细细品味，从买这本书到现在已经一年多了，这本书被我孩子已经看了无数次，他要我一遍遍的讲给他听，一次次的问这是什么，是我给他买的所以书中他最感兴趣的。从这本书中他知道了许多日常生活中的事情，增强了观察力，书中的很小的细节都能看见，e而作为家长其实其中的许多细节原本也不是很了解，也学到了不少，真是物超所值。,对于写评论 说实在比较懒 但对于这本书真的是值得我细细品味 从买这本书到现在已经一年多了 这本书被我孩子已经看了无数次 他要我一遍遍的讲给他听 一次次的问这是什么 是我给他买的所以书中他最感兴趣的 从这本书中他知道了许多日常生活中的事情 增强了观察力 书中的很小的细节都能看见 e而作为家长其实其中的许多细节原本也不是很了解 也学到了不少 真是物超所值,ChnSentiCorp,1,5.0,5
本以为该酒店象其名字一样豪气万千，谁承想却是名不副实。我是五一去的，酒店设施陈旧，卫生环境差。房间设备简陋陈旧，色调灰暗。算不上星级标准，也就是个旅馆，早餐品种很少，将就能吃饱，下次绝对不会再住！,本以为该酒店象其名字一样豪气万千 谁承想却是名不副实 我是五一去的 酒店设施陈旧 卫生环境差 房间设备简陋陈旧 色调灰暗 算不上星级标准 也就是个旅馆 早餐品种很少 将就能吃饱 下次绝对不会再住,ChnSentiCorp,0,1.2,1
味道不错，就是稍微有点硬！,味道不错 就是稍微有点硬,WAIMAI,1,0.2,0
要灵活运用，不能太死板了！记单词还是要开动脑筋，不同的单词用不同的方法，如词根词缀法、联想法、谐音法、逆向法等。,要灵活运用 不能太死板了 记单词还是要开动脑筋 不同的单词用不同的方法 如词根词缀法 联想法 谐音法 逆向法等,ChnSentiCorp,1,0.2,0
时间太久，等了2小时了,时间太久 等了2小时了,WAIMAI,0,0.5,0
抽空休息一下吧，新春快乐！ //@武鑫?:[爱你]//@准备微笑的海燕:期待期待,抽空休息一下吧 新春快乐,WEIBO,1,0.9,1
酒店房间没有桌子 第一次遇到 竟然还有蜘蛛 吓了我一跳 房间设备比较老,酒店房间没有桌子 第一次遇到 竟然还有蜘蛛 吓了我一跳 房间设备比较老,ChnSentiCorp,0,3.7,4
傍晚去了趟海边，乌压压全是人，煮饺子，如果不是有事以后估计不会来大连了，当地人也很苦恼，如今的大连早已失去了昔日的干净的街道和清新的空气，现在的情况太过于商业化，很多正在施工的大楼让城市变得脏乱差。[失望],傍晚去了趟海边 乌压压全是人 煮饺子 如果不是有事以后估计不会来大连了 当地人也很苦恼 如今的大连早已失去了昔日的干净的街道和清新的空气 现在的情况太过于商业化 很多正在施工的大楼让城市变得脏乱差 失望,WEIBO,0,0.6,1
擦[抓狂][抓狂][抓狂][抓狂],擦 抓狂 抓狂 抓狂 抓狂,WEIBO,0,2.0,4
得调调生物钟啊，缺啥都别缺觉，学我。。。[爱你][太开心],得调调生物钟啊 缺啥都别缺觉 学我 爱你 太开心,WEIBO,1,2.1,2
好吃，很清淡,好吃 很清淡,WAIMAI,1,2.2,2
神一样的百度！//@时尚趣味范: 百度知道的太多了！！！ [衰],神一样的百度 百度知道的太多了 衰,WEIBO,0,3.4,3
"希望菜是新鲜的，近期的,清炒油菜，油菜就不如之前。而且有次居然用白菜代替了,都是菜帮子。",希望菜是新鲜的 近期的 清炒油菜 油菜就不如之前 而且有次居然用白菜代替了 都是菜帮子,WAIMAI,0,0.1,0
烤肠都没送！,烤肠都没送,WAIMAI,0,0.7,1
16：41才接到电话，16：45才送到！居然显示16：35已送到…,16 41才接到电话 16 45才送到 居然显示16 35已送到,WAIMAI,0,0.0,0
牛杂很好吃,牛杂很好吃,WAIMAI,1,2.2,2
认真读了一阵时间了，感觉呢——天书啊，古典文学和现代文学思想的是深海，传播学是海浪，深层的暗涌，表层的激荡...天书啊，如何才能读得懂...,认真读了一阵时间了 感觉呢 天书啊 古典文学和现代文学思想的是深海 传播学是海浪 深层的暗涌 表层的激荡 天书啊 如何才能读得懂,ChnSentiCorp,1,1.8,2
还可以，我住的标间368元，卫生间很大，设施比较齐全，热水器有的，床虽然不是大床但是软硬刚好合适，睡了个好觉。但有按摩小姐打骚扰电话，不过也属正常。,还可以 我住的标间368元 卫生间很大 设施比较齐全 热水器有的 床虽然不是大床但是软硬刚好合适 睡了个好觉 但有按摩小姐打骚扰电话 不过也属正常,ChnSentiCorp,1,4.3,4
可惜一直给的五星好评了。送外卖的伙计居然说以后不给我送了。理由是我们楼只有我一个叫餐的,可惜一直给的五星好评了 送外卖的伙计居然说以后不给我送了 理由是我们楼只有我一个叫餐的,WAIMAI,0,0.5,0
味道不错，送餐时间一个多小时,味道不错 送餐时间一个多小时,WAIMAI,1,1.3,1
回复@陈公正: 那租房是否合算，就算租房20年的租金买不来一套房子吧？ //@陈公正:现有产权安排下，只能将房价与长租的总租金现值相比。现在只能希望二十年内房子不会蒸发[衰],回复 那租房是否合算 就算租房20年的租金买不来一套房子吧,WEIBO,0,2.3,2
交通相当便利，既是优点也是缺点，住在十几楼还是有点吵。其它的都还可以吧，四星级嘛。,交通相当便利 既是优点也是缺点 住在十几楼还是有点吵 其它的都还可以吧 四星级嘛,ChnSentiCorp,1,3.0,3
不明白为什么机器是六月产的，有部分驱动却不是最新的，无线上网时断时续，上官网更新驱动后正常。续航时间也没有介绍所说的8小时。,不明白为什么机器是六月产的 有部分驱动却不是最新的 无线上网时断时续 上官网更新驱动后正常 续航时间也没有介绍所说的8小时,ChnSentiCorp,0,2.2,0
不错，肉很多，包装也挺干净,不错 肉很多 包装也挺干净,WAIMAI,1,5.0,5
这个机器的价格和赠品简直无敌了，小本子很轻巧。功能强劲！希望京东以后对退出此类的活动！,这个机器的价格和赠品简直无敌了 小本子很轻巧 功能强劲 希望京东以后对退出此类的活动,ChnSentiCorp,1,5.0,5
世界排名十大变态闹钟，太丧心病狂了[晕][晕][晕],世界排名十大变态闹钟 太丧心病狂了 晕 晕 晕,WEIBO,0,5.0,5
1 底部发热比较厉害 2 windows7系统下，网卡驱动拔下网线驱动就丢失，需要重新安装一次，不知是不是软件问题。,1 底部发热比较厉害 2 windows7系统下 网卡驱动拔下网线驱动就丢失 需要重新安装一次 不知是不是软件问题,ChnSentiCorp,0,5.0,5
某娃说这东西就适合送给我这样华而不实的人，我就怎么华而不实了[怒][疑问][愤怒],某娃说这东西就适合送给我这样华而不实的人 我就怎么华而不实了 怒 疑问 愤怒,WEIBO,0,3.7,4
[泪] 对@兔兔 说：我电影票过期了?????,泪 对 说 我电影票过期了,WEIBO,0,1.8,2
1G的内存有点小，跑起来忒慢 刚到手就便宜200，还送鼠标和杀毒软件了 能不降那么快吗,1G的内存有点小 跑起来忒慢 刚到手就便宜200 还送鼠标和杀毒软件了 能不降那么快吗,ChnSentiCorp,0,0.2,0
作业交得真积极[嘻嘻] //@薇那verna: @雾灵西峰高山滑水  @远方网 @小莫在远方 @大元同学 @空游无依 @高尔夫球爱生活 @I肖河 @一只不会开花的兔 @风中柏杨树 @小李美刀969,作业交得真积极 嘻嘻,WEIBO,1,1.2,1
测试软件显示cpu二极管发热大，开机不久即于62度左右徘徊。 合上时没有弹簧盖扣；一只手无法打开，可能因为“下盘”太轻了，哈。 底部透过一排散热口能看到芯片晶体板，呃，有点不精密的感觉。 屏幕色彩太浓,测试软件显示cpu二极管发热大 开机不久即于62度左右徘徊 合上时没有弹簧盖扣 一只手无法打开 可能因为 下盘 太轻了 哈 底部透过一排散热口能看到芯片晶体板 呃 有点不精密的感觉 屏幕色彩太浓,ChnSentiCorp,0,5.0,5
键盘比想象中的要烂，光驱有时候声音会比较大，摄像头是个鸡肋功能，不错有比没有好...,键盘比想象中的要烂 光驱有时候声音会比较大 摄像头是个鸡肋功能 不错有比没有好,ChnSentiCorp,0,0.4,0
#美食#Geba Geba的笼蒸蔬菜所配的蘸汁，惊艳！咸香的酱油配了浓香的葱蒜油，貌不惊人，但把蒸得刚好的椰菜放在蘸汁里面一游，往嘴里一放，世界突然停顿：天啊！原始简单好味道！[泪][泪][泪],Geba Geba的笼蒸蔬菜所配的蘸汁 惊艳 咸香的酱油配了浓香的葱蒜油 貌不惊人 但把蒸得刚好的椰菜放在蘸汁里面一游 往嘴里一放 世界突然停顿 天啊 原始简单好味道 泪 泪 泪,WEIBO,0,5.0,5
11点半订的餐两点钟到送餐速度太慢。,11点半订的餐两点钟到送餐速度太慢,WAIMAI,0,2.1,2
"不止一次啦,很好哦,爸爸很喜欢呢",不止一次啦 很好哦 爸爸很喜欢呢,WAIMAI,1,5.0,5
买了双ECCO户外鞋，登山去咯！hiahia..... 冬天来了，再不加强身体锻炼，不知道这个冬天又要感冒几次...[晕][晕][生病][生病],买了双ECCO户外鞋 登山去咯 hiahia 冬天来了 再不加强身体锻炼 不知道这个冬天又要感冒几次 晕 晕 生病 生病,WEIBO,0,4.5,4
很好吃，味道很好，若能有一点青菜就更好了！,很好吃 味道很好 若能有一点青菜就更好了,WAIMAI,1,4.0,4
"第一次吃速度很快而且也很不错,以后会继续支持",第一次吃速度很快而且也很不错 以后会继续支持,WAIMAI,1,5.0,5
求偶遇[爱你][做鬼脸] 我在这里:http://t.cn/zRPhyBd,求偶遇 爱你 做鬼脸 我在这里,WEIBO,1,2.5,2
[衰][衰][衰]//@Sunshine_怜小崎: [衰]我擦~！,衰 衰 衰 衰 我擦,WEIBO,0,5.0,5
很准时！口味很好，大爱可可小丸子,很准时 口味很好 大爱可可小丸子,WAIMAI,1,5.0,5
"等的时间长就不说了,还忘了给拿米饭和餐具,等又把主食送到,菜几乎已经不能吃了",等的时间长就不说了 还忘了给拿米饭和餐具 等又把主食送到 菜几乎已经不能吃了,WAIMAI,0,0.1,0
服务不则么样，太旧，旋转餐厅不转的，早餐的服务员好像我欠了他们钱一样，很差,服务不则么样 太旧 旋转餐厅不转的 早餐的服务员好像我欠了他们钱一样 很差,ChnSentiCorp,0,2.3,2
回复@meegood: 你祖先会从store里下app么？ //@meegood:记得还要烧个充电器[哈哈],回复 你祖先会从store里下app么,WEIBO,1,1.0,1
儿子六岁半时，我把已买了一年多的《保姆狗的阴谋》拿出来念个他听，儿子非常感兴趣，竟然在我没空给他念书的时候自己看了起来。就是从这本书开始，儿子不再惧怕没有拼音也没有太多图片的纯文字的书了。他一口气从《保姆狗的阴谋》一直看到了《樱桃沟的春天》，笑猫日记系列一本不拉，本本喜欢。有空时我也看，看完后我俩就开始讨论，最喜欢什么人物，最喜欢什么情节。儿子看得痴迷，我也看得津津有味。,儿子六岁半时 我把已买了一年多的 保姆狗的阴谋 拿出来念个他听 儿子非常感兴趣 竟然在我没空给他念书的时候自己看了起来 就是从这本书开始 儿子不再惧怕没有拼音也没有太多图片的纯文字的书了 他一口气从 保姆狗的阴谋 一直看到了 樱桃沟的春天 笑猫日记系列一本不拉 本本喜欢 有空时我也看 看完后我俩就开始讨论 最喜欢什么人物 最喜欢什么情节 儿子看得痴迷 我也看得津津有味,ChnSentiCorp,1,4.4,4
@唉这个真没有， 大家滴妖怪婆婆happy birthday~~~[挤眼]记得这些我偷拍的图不~~~就是青奥会送你离开千里之外时候偷拍的[可怜][泪]我还记得在新加坡吃的那顿川味火锅，来的时候我还迷路了[害羞]，最后再[右哼哼][左哼哼]下，晚几天走就可以和我们一起去东海岸海边骑自行车了[花心],大家滴妖怪婆婆happy birthday 挤眼 记得这些我偷拍的图不 就是青奥会送你离开千里之外时候偷拍的 可怜 泪 我还记得在新加坡吃的那顿川味火锅 来的时候我还迷路了 害羞 最后再 右哼哼 左哼哼 下 晚几天走就可以和我们一起去东海岸海边骑自行车了 花心,WEIBO,0,3.9,4
显卡还不错了~屏幕也还可以，拿来玩游戏这个价格里找不到可以抗衡的对手了,显卡还不错了 屏幕也还可以 拿来玩游戏这个价格里找不到可以抗衡的对手了,ChnSentiCorp,1,2.2,4
"时间太慢,没胃口",时间太慢 没胃口,WAIMAI,0,2.7,3
1999元抢了一台给朋友，听朋友说机子还算可以，就是装XP系统有点麻烦,1999元抢了一台给朋友 听朋友说机子还算可以 就是装XP系统有点麻烦,ChnSentiCorp,1,1.1,1
好吃，就是牛蛙太少了,好吃 就是牛蛙太少了,WAIMAI,1,0.7,0
全都凉了！！！保温箱是摆设吗？,全都凉了 保温箱是摆设吗,WAIMAI,0,3.1,3
珠峰大本营纪念[嘻嘻],珠峰大本营纪念 嘻嘻,WEIBO,1,3.6,4
红衫军啊！[哈哈],红衫军啊 哈哈,WEIBO,1,2.6,3
“细读纳兰词会发现，豪放是外放的风骨，忧伤才是内敛的精魂。”选这本书全因纳兰容若。清代第一词人，权相之子，御前侍卫，这个连名字都如一阙清词的高贵男子看似拥有世间一切，却半生襟抱未开，情路坎坷，偏又是最最重情之人。于是，便有了顾贞观“家家争唱饮水词，纳兰心事几人知？”的感叹。他三十一年短暂人生的本身，就是一首清丽高华又哀伤入骨的绝世艳词。正如作者所评，纳兰容若，一生恰如三月花。,细读纳兰词会发现 豪放是外放的风骨 忧伤才是内敛的精魂 选这本书全因纳兰容若 清代第一词人 权相之子 御前侍卫 这个连名字都如一阙清词的高贵男子看似拥有世间一切 却半生襟抱未开 情路坎坷 偏又是最最重情之人 于是 便有了顾贞观 家家争唱饮水词 纳兰心事几人知 的感叹 他三十一年短暂人生的本身 就是一首清丽高华又哀伤入骨的绝世艳词 正如作者所评 纳兰容若 一生恰如三月花,ChnSentiCorp,1,5.0,1
态度太差！,态度太差,WAIMAI,0,1.7,3
这个电池着实是奇怪了一点，鼓出来的，影响美观，还有连接的地方，有点松，平衡还不错，要找好角度。,这个电池着实是奇怪了一点 鼓出来的 影响美观 还有连接的地方 有点松 平衡还不错 要找好角度,ChnSentiCorp,0,5.0,5
为什么我们每天订房间，就不送水果、咖啡！协程网上有果盘送的！简直不讲道理！,为什么我们每天订房间 就不送水果 咖啡 协程网上有果盘送的 简直不讲道理,ChnSentiCorp,0,0.5,0
赞一个。很快的,赞一个 很快的,WAIMAI,1,3.8,3
送的有点慢…酱香卷还是很好吃的,送的有点慢 酱香卷还是很好吃的,WAIMAI,1,2.0,2
有点所谓的权利就要发挥到极致。可怜 //@方益松: @廉政御史 你怎么看？ //@张海同学V:[怒],有点所谓的权利就要发挥到极致 可怜 你怎么看,WEIBO,0,1.9,2
猪耳朵又碎又咸，不建议点,猪耳朵又碎又咸 不建议点,WAIMAI,0,5.0,5
好好次的天津五香大花卷[泪][泪][泪],好好次的天津五香大花卷 泪 泪 泪,WEIBO,0,3.8,4
回复@查尔狮Yuan:Charles! You rock!!![good] //@查尔狮Yuan: @Nana环游世界 [嘻嘻]娜姐，i did it[嘻嘻] //@查尔狮Yuan:谢谢谢谢捧场。。。刚发现手机充电线忘拿了[泪]。。@旋花念想 最后那个苹果笔记本谁收拾的呢。。。线在上面么[泪]  //@小明候车中:[good] //@范振东东东:[good],回复 You rock good 嘻嘻 娜姐 i did it 嘻嘻 最后那个苹果笔记本谁收拾的呢 线在上面么 泪,WEIBO,0,5.0,5
态度不太好，送的太慢了…,态度不太好 送的太慢了,WAIMAI,0,3.6,4
回复@豆包1990丫头:做做做 腾出手我就做 我自己也想吃了！ //@豆包1990丫头:回复@BraveCake洛凝L:爱死玛芬了，你现在都不做了[哼]去年答应吃的[泪],回复 腾出手我就做 我自己也想吃了,WEIBO,0,2.9,3
大熊同学请客[嘻嘻],大熊同学请客 嘻嘻,WEIBO,1,2.7,3
我彻底服了!//@刘馨雨-jacqueline: 你小瞧姐了，姐笨不就是个坏人//@我亲爱的老虎: 在这样一个寒冷的冬夜里，刘总，您秒杀了我记忆里您伟光正的形象！[泪]//@刘馨雨-jacqueline:回覆@老武是文建:[??物][要?物][哈哈] //@老武是文建:大姐，服了！[抓狂][酷],我彻底服了 你小瞧姐了 姐笨不就是个坏人 在这样一个寒冷的冬夜里 刘总 您秒杀了我记忆里您伟光正的形象 泪,WEIBO,0,3.4,3
[抓狂]你脾气真好，换了我早把爆米花和可乐拽丫脸上了。,抓狂 你脾气真好 换了我早把爆米花和可乐拽丫脸上了,WEIBO,0,0.1,0
再见!丽江![可爱],再见 丽江 可爱,WEIBO,1,4.0,4
"本人正是受当当网各位评论的误导,以为这是本不买不看就会留有遗憾的好书,发现后便赶紧买下。看过若干页后,真是大呼上当.这哪里象是一本讲述历史的书籍，通篇调侃的风格以及所使用的网络语言、大白话，甚至许多句子多含语病，真是误人不浅。",本人正是受当当网各位评论的误导 以为这是本不买不看就会留有遗憾的好书 发现后便赶紧买下 看过若干页后 真是大呼上当 这哪里象是一本讲述历史的书籍 通篇调侃的风格以及所使用的网络语言 大白话 甚至许多句子多含语病 真是误人不浅,ChnSentiCorp,0,5.0,5
点的是商务套餐，不过换成鳕鱼了,点的是商务套餐 不过换成鳕鱼了,WAIMAI,0,2.7,3
看了大家的评论后买的，可书拿回来后孩子不太感兴趣，给他讲也是总心不在焉，等他大点再看吧。,看了大家的评论后买的 可书拿回来后孩子不太感兴趣 给他讲也是总心不在焉 等他大点再看吧,ChnSentiCorp,0,2.6,3
思念总在分手后[蜡烛] //@丁丁丁雪玲:[泪][蜡烛],思念总在分手后 蜡烛,WEIBO,0,2.1,5
忘了在什么网页上看到其中的一段，着了魔似的拼命搜索，终于下载了电子版的书，在电脑上一下午就看了一半，不解渴啊，我想应该在我床头放上一本呢，于是来当当网，收到书的一刻，心中涌上一阵阵喜悦，舍不得看完，每天一点点，还是很快就看完了，然后又继续订，送朋友，与她们分享这种感动。对待女儿的态度也有明显的变化，耐心好象又回到我身上。。。诚挚向您推荐这本经典。,忘了在什么网页上看到其中的一段 着了魔似的拼命搜索 终于下载了电子版的书 在电脑上一下午就看了一半 不解渴啊 我想应该在我床头放上一本呢 于是来当当网 收到书的一刻 心中涌上一阵阵喜悦 舍不得看完 每天一点点 还是很快就看完了 然后又继续订 送朋友 与她们分享这种感动 对待女儿的态度也有明显的变化 耐心好象又回到我身上 诚挚向您推荐这本经典,ChnSentiCorp,1,5.0,5
好心眼的巨蟹座，为什么总是被人冤枉[抓狂]不搭理好了[懒得理你]蟹蟹们被人冤枉会如何呢？[委屈],好心眼的巨蟹座 为什么总是被人冤枉 抓狂 不搭理好了 懒得理你 蟹蟹们被人冤枉会如何呢 委屈,WEIBO,0,5.0,5
装XP是有点麻烦，在武汉没有客服点，说只为金牌客户服务，就算我去他们那里，一样花钱装，我自己花钱70元在外面装的。,装XP是有点麻烦 在武汉没有客服点 说只为金牌客户服务 就算我去他们那里 一样花钱装 我自己花钱70元在外面装的,ChnSentiCorp,0,3.8,4
来的时候汤洒了！面好吃.牛肉最好在炖的烂一点.,来的时候汤洒了 面好吃 牛肉最好在炖的烂一点,WAIMAI,1,1.8,2
敢 但是控制不好局面[哈哈]//@云泉微博://@贺江兵:我们敢反过来，你们会吗？哼~,敢 但是控制不好局面 哈哈,WEIBO,1,4.0,4
第二站，不说在哪，算避嫌吗[哈哈] 我在这里:http://t.cn/zHecQuK,第二站 不说在哪 算避嫌吗 哈哈 我在这里,WEIBO,1,2.8,3
我的双胞胎儿子5岁，他们很喜欢。我在给他们阅读的时候，他们很安静，聚精会神地倾听。中间我感动得眼泪哗哗地，以致于读不下去，孩子们却没有催促，只是奇怪地看着我并静静地等待我继续读&#183;&#183;&#183;&#183;&#183;&#183;前面很多妈妈都说孩子流泪了，我儿子没有，只是皱起了眉头，表情沉重地问我：它是不是就是死了？好像变懂事了？！,我的双胞胎儿子5岁 他们很喜欢 我在给他们阅读的时候 他们很安静 聚精会神地倾听 中间我感动得眼泪哗哗地 以致于读不下去 孩子们却没有催促 只是奇怪地看着我并静静地等待我继续读 前面很多妈妈都说孩子流泪了 我儿子没有 只是皱起了眉头 表情沉重地问我 它是不是就是死了 好像变懂事了,ChnSentiCorp,1,1.4,1
，，，饭有腐味肉臭，这彭伟这jb傻缺智障送餐员呢，缺德得很，嫁给女的没人要的，吓死了吧，懂么女的取。饭馆啊，我感觉是不想退才说找不到按钮，也是傻的缘故，不过我用灵气把他们变聪明了。女天机星进驻,饭有腐味肉臭 这彭伟这jb傻缺智障送餐员呢 缺德得很 嫁给女的没人要的 吓死了吧 懂么女的取 饭馆啊 我感觉是不想退才说找不到按钮 也是傻的缘故 不过我用灵气把他们变聪明了 女天机星进驻,WAIMAI,0,5.0,5
送餐这个慢啊…………别的不说啥了,送餐这个慢啊 别的不说啥了,WAIMAI,0,3.8,4
我轮船! //@春雷星座王子:游艇准备好了吗？  //@刘小冉0615:是呀!我在昌平呢!下的好大!  //@赫茹:昌平开下啦  //@天气预报:过了城区，就是昌平和顺义，首都机场[抓狂],我轮船,WEIBO,0,0.0,0
"我1月16日下的定单,EMS花了人20大元,直到2月2日才到货.到货一看不是他妈国语,是他妈粤语的.当当就他妈骗子.",我1月16日下的定单 EMS花了人20大元 直到2月2日才到货 到货一看不是他妈国语 是他妈粤语的 当当就他妈骗子,ChnSentiCorp,0,4.8,5
感觉味道没有去实体店好吃,感觉味道没有去实体店好吃,WAIMAI,1,0.4,0
"难吃,点了卤肉没通知直接给换成鸡腿的，也是醉了",难吃 点了卤肉没通知直接给换成鸡腿的 也是醉了,WAIMAI,0,2.8,3
非常差，服务差。房间比较大，但也很差，更重要的是临近铁路，很吵！难怪酒店生意不好，人很少！,非常差 服务差 房间比较大 但也很差 更重要的是临近铁路 很吵 难怪酒店生意不好 人很少,ChnSentiCorp,0,2.6,3
