raw_text,cleaned_text,domain,sentiment,intensity,intensity_level
味道不错！,味道不错,WAIMAI,1,2.7,3
总的来说还可以.几点不足： 1）卫生间有臭味； 2）打的不方便，要走过桥到大街上招呼 3）中餐厅菜偏贵,总的来说还可以 几点不足 1 卫生间有臭味 2 打的不方便 要走过桥到大街上招呼 3 中餐厅菜偏贵,ChnSentiCorp,1,1.0,1
半夜加班high是必须的！//@AlgaeS石鑫: [太开心]//@卉子Huizi:喝喝喝！~~~[噢耶],半夜加班high是必须的 太开心,WEIBO,1,0.1,2
我看了一下，用处不大。作者好象是非专业人士，业余写作在网上发表的，倒是值得鼓励。,我看了一下 用处不大 作者好象是非专业人士 业余写作在网上发表的 倒是值得鼓励,ChnSentiCorp,0,3.9,4
味道很好，鸡肉很多，包装用心,味道很好 鸡肉很多 包装用心,WAIMAI,1,5.0,5
哥哥们，姐姐们，赶紧啊，看我内网，啊哈哈哈哈哈哈哈哈[哈哈],哥哥们 姐姐们 赶紧啊 看我内网 啊哈哈哈哈哈哈哈哈 哈哈,WEIBO,1,3.3,3
宇宙的味道，很好吃！,宇宙的味道 很好吃,WAIMAI,1,3.0,3
@忽而今夏-云 @Sophie诺诺 @光头老薛 看到Milk隋 我乐了…[哈哈][哈哈][哈哈][哈哈]//@Mike隋:请叫我苏伟[泪] //@安达AD612:我还是安//@iSE7EN:请叫我里欧 //@我是曲大美女:请叫我七雨 //@Charles郭濮源: 请叫我鸽窝,看到Milk隋 我乐了 哈哈 哈哈 哈哈 哈哈 请叫我鸽窝,WEIBO,0,5.0,5
我点的菜打印出来显示81.5却收了我102。送餐的说是给他们的价格。感觉不好。,我点的菜打印出来显示81 5却收了我102 送餐的说是给他们的价格 感觉不好,WAIMAI,0,2.5,2
送餐实在太慢了，整2个小时，辣菜也不注明，失望,送餐实在太慢了 整2个小时 辣菜也不注明 失望,WAIMAI,0,1.8,2
折腾了一早上，终于在北京中医医院成功就诊了，好累~谢谢关心我的人们~[爱你][爱你][爱你][爱你][爱你][爱你][爱你][爱你][爱你],折腾了一早上 终于在北京中医医院成功就诊了 好累 谢谢关心我的人们 爱你 爱你 爱你 爱你 爱你 爱你 爱你 爱你 爱你,WEIBO,1,5.0,5
生日快乐@忧郁的石头joe ，屁股挺白的啊[哈哈][哈哈],生日快乐 屁股挺白的啊 哈哈 哈哈,WEIBO,1,4.0,4
掌托较热，触控板易误碰到 触控板下方标有蓝牙标志，但没有内置蓝牙 屏幕色彩一般,掌托较热 触控板易误碰到 触控板下方标有蓝牙标志 但没有内置蓝牙 屏幕色彩一般,ChnSentiCorp,0,1.0,1
外观时尚，配置还行。东京送货很快我10号下午定的货还是分期付款的，结果11号上午就送货了。,外观时尚 配置还行 东京送货很快我10号下午定的货还是分期付款的 结果11号上午就送货了,ChnSentiCorp,1,4.2,4
和舍友一起定的，他先来，等了20min我的才来，还又给舍友送了一份,和舍友一起定的 他先来 等了20min我的才来 还又给舍友送了一份,WAIMAI,0,1.0,1
这就是嘬死的表现//@徐德亮：一定要转！这才是有钱人呢。明儿人家就能拿一亿把天安门买下来，你们敢不信？//@张德武先生：[哈哈] //@老北京网掌柜：中国之最傻逼的游客！有钱了不起？我看你就是一个孙子！,这就是嘬死的表现,WEIBO,1,1.9,2
是个有血性的汉子！[哈哈],是个有血性的汉子 哈哈,WEIBO,1,3.1,3
"慢慢慢！！！！差差差！！！！送来都凉了,第一次点这家，也是最后一次点了！",慢慢慢 差差差 送来都凉了 第一次点这家 也是最后一次点了,WAIMAI,0,2.2,2
不是《庄子》里所有的文章都一定是庄子本人所做，大家要正确看待，读《庄子》要用心去领会，考别人教的话，顶多是他人消化过的看法，我们要先有一定的理解，再结合各种观点去更好地领会其中的奥妙。再说这本书又要翻译，《庄子》原文内容又多，怎么可能是全本呢，选的时候自然要注意。很多人喜欢拿历史人物的局限性来诟病他们，切不可如此，试想再过2000年有谁能保证后人不拿我们的局限性来诟病我们呢？,不是 庄子 里所有的文章都一定是庄子本人所做 大家要正确看待 读 庄子 要用心去领会 考别人教的话 顶多是他人消化过的看法 我们要先有一定的理解 再结合各种观点去更好地领会其中的奥妙 再说这本书又要翻译 庄子 原文内容又多 怎么可能是全本呢 选的时候自然要注意 很多人喜欢拿历史人物的局限性来诟病他们 切不可如此 试想再过2000年有谁能保证后人不拿我们的局限性来诟病我们呢,ChnSentiCorp,1,5.0,5
菜老了，鹌鹑蛋是臭的，重点是：我的烧饼呢？！,菜老了 鹌鹑蛋是臭的 重点是 我的烧饼呢,WAIMAI,0,3.1,3
"今天才知道这书还有第6卷,真有点郁闷:为什么同一套书有两种版本呢?当当网是不是该跟出版社商量商量,单独出个第6卷,让我们的孩子不会有所遗憾。",今天才知道这书还有第6卷 真有点郁闷 为什么同一套书有两种版本呢 当当网是不是该跟出版社商量商量 单独出个第6卷 让我们的孩子不会有所遗憾,ChnSentiCorp,1,0.9,1
味道很好，就是手滑点成冰的了，悲剧,味道很好 就是手滑点成冰的了 悲剧,WAIMAI,1,0.1,0
只能自己努力呢？？说了也等于白说。 //@微博搞笑排行榜:转给男生们看看。[嘻嘻],只能自己努力呢 说了也等于白说,WEIBO,1,2.0,2
离市区远，浴池下水不畅，晚上外面施工，服务员态度恶劣，垃圾酒店,离市区远 浴池下水不畅 晚上外面施工 服务员态度恶劣 垃圾酒店,ChnSentiCorp,0,2.0,2
//@导演孙周: [哈哈][赞]菊千代695:这个国家的一切似乎都是临时的、暂定的、凑合的。我们也是凑合活着。,哈哈 赞 菊千代695 这个国家的一切似乎都是临时的 暂定的 凑合的 我们也是凑合活着,WEIBO,1,5.0,5
笔记本不错，京东不够厚道，钻石抢的和现在促销价没差几分，这不是忽悠我们钻石一族吗？？？,笔记本不错 京东不够厚道 钻石抢的和现在促销价没差几分 这不是忽悠我们钻石一族吗,ChnSentiCorp,1,5.0,5
刚刚在电视看到这条新闻，相信自己目睹了真正的英雄，在天之灵，安息吧！  //@历史这点事儿:[泪][蜡烛] //@上海的格桑:转发微博,刚刚在电视看到这条新闻 相信自己目睹了真正的英雄 在天之灵 安息吧,WEIBO,0,0.1,3
买的时候，看了评论都说不错可是买来才知道，其实也就那样我还没给孩子看呢我想，她也许不会喜欢,买的时候 看了评论都说不错可是买来才知道 其实也就那样我还没给孩子看呢我想 她也许不会喜欢,ChnSentiCorp,0,5.0,5
卷饼真的不错！拌饭也还可以,卷饼真的不错 拌饭也还可以,WAIMAI,1,0.9,1
回头是岸！[偷笑][偷笑][偷笑] //@汽车营销分析:一看就懂，过目不忘。 //@现代小猪爸爸:广宣的要义啊！浓缩起来就是4个字：一看就懂！[哈哈],回头是岸 偷笑 偷笑 偷笑,WEIBO,1,0.0,0
曲奇很好喝,曲奇很好喝,WAIMAI,1,2.1,2
送货速度真的太快了！！,送货速度真的太快了,WAIMAI,1,0.3,0
啊！我爱的长颈鹿！[爱你],啊 我爱的长颈鹿 爱你,WEIBO,1,3.5,0
房间大，装修好，服务佳。。。就房间而言，不逊于5星 还会来住,房间大 装修好 服务佳 就房间而言 不逊于5星 还会来住,ChnSentiCorp,1,4.5,4
送的还是很快的，店家也熟悉，就是不知道怎么选辣不辣,送的还是很快的 店家也熟悉 就是不知道怎么选辣不辣,WAIMAI,1,0.5,0
电源适配器烫的厉害啊 真的 狠烫 而且电脑里面很多东西没有装 要自己动手 没有鼠标没有保护膜 没有杀毒软件 没有鼠标垫 基本上什么都没有 而且 京东送货的速度 越来越慢了,电源适配器烫的厉害啊 真的 狠烫 而且电脑里面很多东西没有装 要自己动手 没有鼠标没有保护膜 没有杀毒软件 没有鼠标垫 基本上什么都没有 而且 京东送货的速度 越来越慢了,ChnSentiCorp,0,0.4,0
@杨宝顶 果然如你所说，灰色星期五了。你是吐槽帝。 //@我们爱讲冷笑话:怎么有种莫名忧伤。[泪],果然如你所说 灰色星期五了 你是吐槽帝,WEIBO,0,1.0,1
酱紫啊~~ //@周艺文:[嘻嘻]  //@摄氏7公里://@亮亮selina:[哈哈] //@微博热点:原来如此……搜逗死乃,酱紫啊,WEIBO,1,2.2,2
使用电源适配器的时候，其发热量够惊人，有点担心会烧坏，触摸板太灵敏了，触摸板的按键确实有点硬，塑料外壳不是很结实，像玩具，没有华硕的大本装配工艺好。,使用电源适配器的时候 其发热量够惊人 有点担心会烧坏 触摸板太灵敏了 触摸板的按键确实有点硬 塑料外壳不是很结实 像玩具 没有华硕的大本装配工艺好,ChnSentiCorp,0,0.1,5
订餐时间是中午1点，等了一个多小时才送到，打开一看量少的惊人，炸薯条成了粉条，软绵绵的，拌饭里的蔬菜跟剩了几天的菜一样，黑乎乎的，炸鸡更难吃，价格一点不便宜，还做的这么难吃，第一次定也是最后一次！这里不能放图片很可惜！,订餐时间是中午1点 等了一个多小时才送到 打开一看量少的惊人 炸薯条成了粉条 软绵绵的 拌饭里的蔬菜跟剩了几天的菜一样 黑乎乎的 炸鸡更难吃 价格一点不便宜 还做的这么难吃 第一次定也是最后一次 这里不能放图片很可惜,WAIMAI,0,3.3,3
一个小学生的梦想。同学在QQ群里发的，他同事的家属在当小学老师，看到这样的作文，不知道咋批改了。[哈哈],一个小学生的梦想 同学在QQ群里发的 他同事的家属在当小学老师 看到这样的作文 不知道咋批改了 哈哈,WEIBO,1,3.9,4
吃两次都坏肚子了,吃两次都坏肚子了,WAIMAI,0,3.8,4
[威武][鼓掌]机不可失！,威武 鼓掌 机不可失,WEIBO,1,5.0,2
你???了？?在玩木?？[嘻嘻][嘻嘻][嘻嘻]@李?男LL,你 了 在玩木 嘻嘻 嘻嘻 嘻嘻,WEIBO,1,0.2,0
回复@河北解放:干脆就开你办公室里吧！[威武][哈哈] //@河北解放:就在我办公室门口吧，蹭饭不用走几步 //@嗨辣老孙:回复@心泉之家:昨晚俺备的肉全被扫荡一空！[吃惊][抓狂]  //@心泉之家:啊？@嗨辣老孙 您没准备够牛肉啊？,回复 您没准备够牛肉啊,WEIBO,0,0.3,0
真心不好吃，面是坨的，肉夹馍没味道，凉皮油了吧唧，再也不定了,真心不好吃 面是坨的 肉夹馍没味道 凉皮油了吧唧 再也不定了,WAIMAI,0,1.5,1
送饭速度太慢,送饭速度太慢,WAIMAI,0,1.5,1
键盘布局被修改了，还是喜欢以前IBM的布局，和台式机保持一致哎，被联想给耽误了，键盘灯也被去掉了，难怪价格这么便宜。,键盘布局被修改了 还是喜欢以前IBM的布局 和台式机保持一致哎 被联想给耽误了 键盘灯也被去掉了 难怪价格这么便宜,ChnSentiCorp,0,1.3,1
物流特别慢，催了一次单，打了一次客服，评价居然显示12：50送达，你送到了吗？一点半才送到好不！等了一个多小时！,物流特别慢 催了一次单 打了一次客服 评价居然显示12 50送达 你送到了吗 一点半才送到好不 等了一个多小时,WAIMAI,0,3.6,4
镜面的容易留指纹，休眠后开机老出问题，可能是备份的问题，还没搞懂,镜面的容易留指纹 休眠后开机老出问题 可能是备份的问题 还没搞懂,ChnSentiCorp,0,3.0,3
味道一般，速度还挺快的,味道一般 速度还挺快的,WAIMAI,1,2.0,2
第一次买烤漆的本，比想象中好看，朋友也说好 thinkpad也是第一买，和想象中一样 ，质量好，现在用一段时间了，确实很好。 发热少，也没什么噪音，我觉得很值,第一次买烤漆的本 比想象中好看 朋友也说好 thinkpad也是第一买 和想象中一样 质量好 现在用一段时间了 确实很好 发热少 也没什么噪音 我觉得很值,ChnSentiCorp,1,5.0,5
"有点凉,很好吃",有点凉 很好吃,WAIMAI,1,0.5,0
下次就照这个拍 换背景[笑哈哈]//@annie_duyini是王老师他对象: @播放WBF [爱你] //@-绯红-:喜欢 //@小??_心公主搭进搭册:@-绯红- @施忆佳KITTY酱 推荐哟,下次就照这个拍 换背景 笑哈哈 爱你 推荐哟,WEIBO,1,5.0,5
撒花~[礼花] //@胖星儿：可以进入下面的链接地址去提问~10分钟后，我去那里回答问题了。再一次请亲朋好友耐心看我刷屏，当然也可以暂时取消关注就消停了，但请记得1小时后恢复哦。[爱你] //@新浪女性：3点开始哟~幸福就是每天晚上回家吃饭！超人气时尚主妇@胖星儿 将与你一起分享美味晚餐的速成秘诀！,撒花 礼花 将与你一起分享美味晚餐的速成秘诀,WEIBO,1,5.0,2
太腻了，里面好多肥肉，吃完都犯恶心。。。,太腻了 里面好多肥肉 吃完都犯恶心,WAIMAI,0,5.0,5
用了半个月了，到目前为止还没发现什么不良状况，总体感觉还不错。同等配置下，这个价格真的算是实惠了吧...,用了半个月了 到目前为止还没发现什么不良状况 总体感觉还不错 同等配置下 这个价格真的算是实惠了吧,ChnSentiCorp,1,2.8,3
Vista跑起来有点慢，要是XP就好了。250G只有一个分区，真没法用。没带任何系统光盘和驱动，提不方便了。想自己分区改XP，上网查了一下，不是一般的麻烦，一直没敢动手。,Vista跑起来有点慢 要是XP就好了 250G只有一个分区 真没法用 没带任何系统光盘和驱动 提不方便了 想自己分区改XP 上网查了一下 不是一般的麻烦 一直没敢动手,ChnSentiCorp,0,4.6,5
[怒]//@第三炉香: //@Lyra小坏兽哥斯拉: 必须转,怒 必须转,WEIBO,0,0.4,0
住了特价的房间，实在是差的没法说了，房间小得完全出乎意料，像个剩余的角落留出来的空间弄了这么一个房间。还有停车场，实在不方便，而且地下三层，而且非常的陈旧，去停车场的电梯怕怕。第一次遇到这么差的停车场。 下次不再去，永远也不去。 宾馆反馈 2008年8月4日 ： 尊敬的客人您好，首先感谢您对酒店的评价，对于您在酒店的遭遇我们深表歉意，酒店除了特价大床房之外还有其他多种房型可供您选择，对于停车如您遇到困难可向前台与酒店安保部门联系，我们会第一时间为您解决。我们还是希望您能再次光临，在下次入住之时会给您一个不一样的感觉！,住了特价的房间 实在是差的没法说了 房间小得完全出乎意料 像个剩余的角落留出来的空间弄了这么一个房间 还有停车场 实在不方便 而且地下三层 而且非常的陈旧 去停车场的电梯怕怕 第一次遇到这么差的停车场 下次不再去 永远也不去 宾馆反馈 2008年8月4日 尊敬的客人您好 首先感谢您对酒店的评价 对于您在酒店的遭遇我们深表歉意 酒店除了特价大床房之外还有其他多种房型可供您选择 对于停车如您遇到困难可向前台与酒店安保部门联系 我们会第一时间为您解决 我们还是希望您能再次光临 在下次入住之时会给您一个不一样的感觉,ChnSentiCorp,0,5.0,5
我是那百分之二的人[鼓掌][鼓掌][鼓掌] //@张泉灵:[吃惊][晕][哼],我是那百分之二的人 鼓掌 鼓掌 鼓掌,WEIBO,1,2.8,3
"九转大肠不错,其他一般啦！",九转大肠不错 其他一般啦,WAIMAI,0,4.2,4
不错～特别皮蛋瘦肉粥超级好喝～,不错 特别皮蛋瘦肉粥超级好喝,WAIMAI,1,3.2,3
哥唱的不是歌，是幽默。[哈哈],哥唱的不是歌 是幽默 哈哈,WEIBO,1,3.8,4
"定的行政房间正对杂物间,们一直敞着,别提多脏乱.要求换房后,房间空调不制冷,冰箱向推土机,要求再换,门口楼道铺了块巨大脏布,因为隔壁在装修,不知携程和这个酒店有什么过节,总感觉是在故意让你难受,另外所有房间的电话没有内线指示,竟让客人用长途打回酒店转接,我靠!还有五星级的小姐怎么那么..真是影响北京市容和奥运的和谐环境,房间的餐厅送餐味道会叫你吐出来的.这是本人目前住过的最让人""难忘的""酒店.这些话本人已经在克制了.",定的行政房间正对杂物间 们一直敞着 别提多脏乱 要求换房后 房间空调不制冷 冰箱向推土机 要求再换 门口楼道铺了块巨大脏布 因为隔壁在装修 不知携程和这个酒店有什么过节 总感觉是在故意让你难受 另外所有房间的电话没有内线指示 竟让客人用长途打回酒店转接 我靠 还有五星级的小姐怎么那么 真是影响北京市容和奥运的和谐环境 房间的餐厅送餐味道会叫你吐出来的 这是本人目前住过的最让人 难忘的 酒店 这些话本人已经在克制了,ChnSentiCorp,0,5.0,5
带扣的盒子撒了一袋子菜汤，还吃屁啊，跳摇滚送的吗？？？,带扣的盒子撒了一袋子菜汤 还吃屁啊 跳摇滚送的吗,WAIMAI,0,1.5,1
口味可以，就是太辣了。而且送餐时间很慢,口味可以 就是太辣了 而且送餐时间很慢,WAIMAI,0,1.4,1
味道很不错，还送湿纸巾，很细致。点赞。,味道很不错 还送湿纸巾 很细致 点赞,WAIMAI,1,5.0,5
"晕,怎么还推荐这本书给2-10岁儿童. 看了第一本,只有两个概念:1.不按时睡觉!2.结婚生小孩!",晕 怎么还推荐这本书给2 10岁儿童 看了第一本 只有两个概念 1 不按时睡觉 2 结婚生小孩,ChnSentiCorp,0,0.4,0
//@凹凸猫_王雨: 不是人！可恨[怒][怒]@魔术演员崔凯 //@相声演员王勇://@天津市名流茶馆于浩泽: 我了个去！人肉她 //@罗峰--罗大牙: 先剁了她！ //@可惜我是女流氓:求人肉！[怒],不是人 可恨 怒 怒 我了个去 人肉她 先剁了她,WEIBO,0,5.0,5
听介绍想拿此书弥补英文上的一点翻译陋习，显然粗看了此书后，对于读完高中英语的人们来说，此书内容太浅了，里面的例子的图片貌似都是网上截图的说。另外我买了一大堆书就这本质量有问题，书脊都被压坏了，申请换书居然麻烦到让人发指，可笑的是申请退书居然简单到让人抓狂。静静的等待退书中……,听介绍想拿此书弥补英文上的一点翻译陋习 显然粗看了此书后 对于读完高中英语的人们来说 此书内容太浅了 里面的例子的图片貌似都是网上截图的说 另外我买了一大堆书就这本质量有问题 书脊都被压坏了 申请换书居然麻烦到让人发指 可笑的是申请退书居然简单到让人抓狂 静静的等待退书中,ChnSentiCorp,0,5.0,5
服务还可以，房间好，888888888888888888888888,服务还可以 房间好 888888888888888888888888,ChnSentiCorp,1,3.0,3
严重声讨@黑兔爷_荷包兔子 对一颗好不容易平静之不太衰老的童心赤裸勾引[泪][嘻嘻][偷笑],严重声讨 对一颗好不容易平静之不太衰老的童心赤裸勾引 泪 嘻嘻 偷笑,WEIBO,0,1.3,4
TM脑残！活该被甩！[怒][怒][怒],TM脑残 活该被甩 怒 怒 怒,WEIBO,0,5.0,5
恐龙就是这么灭绝的[抓狂],恐龙就是这么灭绝的 抓狂,WEIBO,0,2.8,3
"vista很纠结..老婆喜欢的界面..我本来想换来着,不过今天装xp失败了,不过还好分区分好了就行,基本不影响",vista很纠结 老婆喜欢的界面 我本来想换来着 不过今天装xp失败了 不过还好分区分好了就行 基本不影响,ChnSentiCorp,0,1.8,2
今天被老领导教育了[泪],今天被老领导教育了 泪,WEIBO,0,1.8,2
看到网上有如此好的评论才买下了这本书，哪里想到这本书根本就不值得一看，说实话就是作者自我吹捧得一本书，也不知以前的童鞋们是出于什么目的对这本书有如此好的评价，简直就是“托”。,看到网上有如此好的评论才买下了这本书 哪里想到这本书根本就不值得一看 说实话就是作者自我吹捧得一本书 也不知以前的童鞋们是出于什么目的对这本书有如此好的评价 简直就是 托,ChnSentiCorp,0,5.0,1
外观还可以，其实不如黑性价比高，给女孩用的喜欢这个颜色，没办法，速度还可以。独显也就应付一般游戏。高清视频完全没问题。就是太重了。跟14寸的一样了。,外观还可以 其实不如黑性价比高 给女孩用的喜欢这个颜色 没办法 速度还可以 独显也就应付一般游戏 高清视频完全没问题 就是太重了 跟14寸的一样了,ChnSentiCorp,1,2.9,3
"好吃,送的很快",好吃 送的很快,WAIMAI,1,2.6,3
看了这本书，我又一次觉得自己真是才疏学浅，又一次看到天外高人的风采。是啊，在这个纸醉金迷的时代，我们要怎么样才能保证自己的一颗本性不变的心不被外部的纷纷扰扰迷惑呢？我们需要思考，我还没有认真地阅读过《中国不高兴》这本书，但是仅仅看完《中国为什么不高兴》后，我就已经觉得自己没有什么为祖国沾沾自喜的地方了，毕竟，我们欠缺的东西还是在很多。,看了这本书 我又一次觉得自己真是才疏学浅 又一次看到天外高人的风采 是啊 在这个纸醉金迷的时代 我们要怎么样才能保证自己的一颗本性不变的心不被外部的纷纷扰扰迷惑呢 我们需要思考 我还没有认真地阅读过 中国不高兴 这本书 但是仅仅看完 中国为什么不高兴 后 我就已经觉得自己没有什么为祖国沾沾自喜的地方了 毕竟 我们欠缺的东西还是在很多,ChnSentiCorp,1,3.8,4
看了一个月还没看完 现在的书广告太凶了 内容很平淡语言也一般 不知道是不是翻译的问题,看了一个月还没看完 现在的书广告太凶了 内容很平淡语言也一般 不知道是不是翻译的问题,ChnSentiCorp,0,0.3,0
换内存不是很方便，没有XP操作系统。 另外硬盘如果要改成SATA格式比较麻烦，估计现在有50%的人还不知要硬盘要打专业驱动。另外，奶奶的，串口到哪去了，DELL工作人员，告诉我是有的，到底在哪,换内存不是很方便 没有XP操作系统 另外硬盘如果要改成SATA格式比较麻烦 估计现在有50 的人还不知要硬盘要打专业驱动 另外 奶奶的 串口到哪去了 DELL工作人员 告诉我是有的 到底在哪,ChnSentiCorp,0,5.0,5
非常不愉快的入住。朋友是晚上11：30左右到达的，此时的柜台服务只有1人，连服务生整个大堂只有3个人，因为年纪比较大，本来行李想让服务生帮忙，招手示意后他们竟然不理睬并且跑开。check in的时候连刷两张信用卡竟然说信用卡不能用，很莫名其妙。房间的设施极差，灯光很暗，酒店的东西非常破旧，真是有损5星级的标准。难怪朋友会说这家酒店的客人非常少，都吓跑掉了。还是在繁华的南京路附近，真是丢人。,非常不愉快的入住 朋友是晚上11 30左右到达的 此时的柜台服务只有1人 连服务生整个大堂只有3个人 因为年纪比较大 本来行李想让服务生帮忙 招手示意后他们竟然不理睬并且跑开 check in的时候连刷两张信用卡竟然说信用卡不能用 很莫名其妙 房间的设施极差 灯光很暗 酒店的东西非常破旧 真是有损5星级的标准 难怪朋友会说这家酒店的客人非常少 都吓跑掉了 还是在繁华的南京路附近 真是丢人,ChnSentiCorp,0,0.7,1
我10:25左右下的单，建议11:45送到，结果一直到下午1:29才给我打电话，打百度外卖电话取消订单了,我10 25左右下的单 建议11 45送到 结果一直到下午1 29才给我打电话 打百度外卖电话取消订单了,WAIMAI,0,0.1,0
最爱青城家的饭菜～如今终于可以外卖啦～带娃来不及做饭时首选青城～主要是吃的放心，很干净，菜的味道有家的感觉，老板人特别好，这也是老店如此火的原因，希望能出些新的菜品哈哈！,最爱青城家的饭菜 如今终于可以外卖啦 带娃来不及做饭时首选青城 主要是吃的放心 很干净 菜的味道有家的感觉 老板人特别好 这也是老店如此火的原因 希望能出些新的菜品哈哈,WAIMAI,1,5.0,5
发热量大，不带系统，随机光盘只有Vista系统的驱动程序，XP的驱动要自己去下载！,发热量大 不带系统 随机光盘只有Vista系统的驱动程序 XP的驱动要自己去下载,ChnSentiCorp,0,3.3,3
[失望]是被恢复性拆迁的老宅吗？,失望 是被恢复性拆迁的老宅吗,WEIBO,0,4.1,4
#拍码族#@霖沐_ 要追逐内心最真实的自己！[鼓掌]。,要追逐内心最真实的自己 鼓掌,WEIBO,1,4.1,4
一个多小时送到！打开之后发现饭都是凉的！！！差到家了！,一个多小时送到 打开之后发现饭都是凉的 差到家了,WAIMAI,0,3.7,4
坐着，一直坐着，是一切腰酸背痛腿抽筋的根源[抓狂]改行！当服务员吧[哈哈],坐着 一直坐着 是一切腰酸背痛腿抽筋的根源 抓狂 改行 当服务员吧 哈哈,WEIBO,0,0.4,0
[赞][鼓掌]//@阜阳热线波哥://@阜阳热线荷风:我们#带着微博去旅行 #@阜阳热线传媒 @丹致2012 @阜阳热线走得更近 欣赏婺源的油菜花！,赞 鼓掌 欣赏婺源的油菜花,WEIBO,1,5.0,5
鲁迅说：绝不宽宥恶人[怒],鲁迅说 绝不宽宥恶人 怒,WEIBO,0,4.7,5
十一不出门旅游，好无聊。求勾搭[爱你],十一不出门旅游 好无聊 求勾搭 爱你,WEIBO,1,1.6,2
